{
  "id": "gallery-grid",
  "namespace": "wuzzkang.core",
  "schemaVersion": "1.0.0",
  "displayName": "Gallery Grid Section",
  "description": "Image gallery grid showcasing portfolio items or product photos.",
  "category": "features",
  "tags": ["gallery", "photos", "portfolio", "grid"],
  "schema": [
    { "key": "headline", "type": "text", "label": "Section Headline", "required": true, "aiGeneratable": true },
    { "key": "imagesList", "type": "list", "label": "Gallery Images List", "required": true }
  ],
  "defaults": {
    "headline": { "$type": "text", "value": "Galeri & Portofolio" },
    "imagesList": {
      "$type": "list",
      "items": [
        { "$type": "text", "value": "Project Visual Builder V2" },
        { "$type": "text", "value": "Dashboard Component Editor" },
        { "$type": "text", "value": "Preview Iframe Engine" }
      ]
    }
  },
  "capabilities": {
    "supportsAIGeneration": true,
    "supportsAnimation": true,
    "supportsChildren": false,
    "responsiveBehavior": "fluid"
  }
}
